{
  "archive": {
    "bytes": 13475,
    "sha256": "bdfc186bf8c0746ad513859cdc3cb67fa9ab36fdd59d64de7356133ce9af2abf",
    "validity": "VALID"
  },
  "audit_id": "814df96ba3d430d4",
  "category": "NO_SUPPORTED_TEST_SOURCE_IDENTIFIED",
  "decision_blocking_unresolved_reasons": [],
  "implementation_id": "REFERENCE_V4_1_IMPLEMENTATION_B_RUBY_1_0",
  "negative_decision_completeness": {
    "archive_identity": true,
    "no_decisive_collision": true,
    "no_decisive_nonregular": true,
    "no_generated_marker": true,
    "no_positive": true,
    "no_suspicious_test_intent": true,
    "no_unsupported_test_intent": true,
    "path_boundary": true,
    "supported_sources_decoded": true
  },
  "nondecisive_warnings": [],
  "positive_evidence": [],
  "schema": "PAPER04_N2_REFERENCE_V4_1_SOURCE_RESULT_1_0"
}
