{
  "archive": {
    "bytes": 24947,
    "sha256": "ed37afb50816dc6d38d709ccbfc630352f83d8c2ee55ca14a82ebe539b04c772",
    "validity": "VALID"
  },
  "audit_id": "53d4bc53bea41799",
  "category": "SOURCE_EVIDENCE_UNRESOLVED",
  "decision_blocking_unresolved_reasons": [
    "GENERATED_TEST_SOURCE_NOT_STATICALLY_PRESENT"
  ],
  "implementation_id": "REFERENCE_V4_1_IMPLEMENTATION_A_PYTHON_1_0",
  "negative_decision_completeness": {
    "archive_identity": true,
    "no_decisive_collision": true,
    "no_decisive_nonregular": true,
    "no_generated_marker": false,
    "no_positive": true,
    "no_suspicious_test_intent": true,
    "no_unsupported_test_intent": true,
    "path_boundary": true,
    "supported_sources_decoded": true
  },
  "nondecisive_warnings": [],
  "positive_evidence": [],
  "schema": "PAPER04_N2_REFERENCE_V4_1_SOURCE_RESULT_1_0"
}
