{
  "archive": {
    "bytes": 2475,
    "sha256": "0ef377b0e8b08789d526c1b689fd445ac24a4777b5a59efb083c47b3aa584710",
    "validity": "VALID"
  },
  "audit_id": "e0adc04190ac3e0c",
  "category": "NO_SUPPORTED_TEST_SOURCE_IDENTIFIED",
  "decision_blocking_unresolved_reasons": [],
  "implementation_id": "REFERENCE_V4_1_IMPLEMENTATION_B_RUBY_1_0",
  "negative_decision_completeness": {
    "archive_identity": true,
    "no_decisive_collision": true,
    "no_decisive_nonregular": true,
    "no_generated_marker": true,
    "no_positive": true,
    "no_suspicious_test_intent": true,
    "no_unsupported_test_intent": true,
    "path_boundary": true,
    "supported_sources_decoded": true
  },
  "nondecisive_warnings": [],
  "positive_evidence": [],
  "schema": "PAPER04_N2_REFERENCE_V4_1_SOURCE_RESULT_1_0"
}
