{
  "archive": {
    "bytes": 11449129,
    "sha256": "83cf3655f35098d7b3cff903662b0242029088471ac8b3b0c53132570780487a",
    "validity": "VALID"
  },
  "audit_id": "02c2759e36ff3b79",
  "category": "SOURCE_SUPPORTED_TEST_PRESENCE",
  "decision_blocking_unresolved_reasons": [],
  "implementation_id": "REFERENCE_V4_1_IMPLEMENTATION_A_PYTHON_1_0",
  "negative_decision_completeness": {
    "archive_identity": true,
    "no_decisive_collision": true,
    "no_decisive_nonregular": true,
    "no_generated_marker": true,
    "no_positive": false,
    "no_suspicious_test_intent": false,
    "no_unsupported_test_intent": false,
    "path_boundary": true,
    "supported_sources_decoded": true
  },
  "nondecisive_warnings": [
    "SUSPICIOUS_TEST_INTENT_WITHOUT_SUPPORTED_FRAMEWORK",
    "UNSUPPORTED_LANGUAGE_TEST_INTENT"
  ],
  "positive_evidence": [
    {
      "path": "zheng-demo/zheng-demo-rpc-service/src/test/java/com/zheng/AppTest.java",
      "sha256": "3c0cc4cf3e2484822b7f5dabd04bcf0fcd42dc999ef73e36c5a10ea9acc84b0a",
      "supporting_rules": [
        "PATH_B_JUNIT_TEST_INTENT_FRAMEWORK_EVIDENCE",
        "STRONG_JUNIT_TESTCASE_INHERITANCE"
      ]
    },
    {
      "path": "zheng-pay/zheng-pay-sdk/src/test/java/com/zheng/pay/sdk/AppTest.java",
      "sha256": "49d1aa30e73800e8262a172b6f20d23184c142cfd25eba3cbd6c8e626680356f",
      "supporting_rules": [
        "PATH_B_JUNIT_TEST_INTENT_FRAMEWORK_EVIDENCE",
        "STRONG_JUNIT_TESTCASE_INHERITANCE"
      ]
    },
    {
      "path": "zheng-upms/zheng-upms-rpc-service/src/test/java/com/zheng/upms/rpc/service/UpmsServiceTest.java",
      "sha256": "47246f34ce6ede5fd3acaa5e8155d3994b0dc5e68d4528dec652808d92592fef",
      "supporting_rules": [
        "PATH_B_JUNIT_TEST_INTENT_FRAMEWORK_EVIDENCE",
        "STRONG_JUNIT_DECLARATION"
      ]
    },
    {
      "path": "zheng-upms/zheng-upms-server/src/test/java/com/zheng/upms/server/UpmsServiceTest.java",
      "sha256": "11cd4d227acd5e52db5f300716d7a86ae397ab60b22a838f127c9b9cbed883c0",
      "supporting_rules": [
        "PATH_B_JUNIT_TEST_INTENT_FRAMEWORK_EVIDENCE",
        "STRONG_JUNIT_DECLARATION"
      ]
    },
    {
      "path": "zheng-wechat/zheng-wechat-mp/zheng-wechat-mp-service/src/test/java/com/zheng/wechat/mp/service/AppTest.java",
      "sha256": "b15203d8e553d68b259243e6dc54c5176766f46c692234d68f0604997bdf0c96",
      "supporting_rules": [
        "PATH_B_JUNIT_TEST_INTENT_FRAMEWORK_EVIDENCE",
        "STRONG_JUNIT_TESTCASE_INHERITANCE"
      ]
    }
  ],
  "schema": "PAPER04_N2_REFERENCE_V4_1_SOURCE_RESULT_1_0"
}
