{
  "archive": {
    "bytes": 15306,
    "sha256": "912039e650a432c8e8f95ffc1d987077f449031d23be70eaacba2af531cc5e8a",
    "validity": "VALID"
  },
  "audit_id": "a808eb4290d2a361",
  "category": "NO_SUPPORTED_TEST_SOURCE_IDENTIFIED",
  "decision_blocking_unresolved_reasons": [],
  "implementation_id": "REFERENCE_V4_1_IMPLEMENTATION_A_PYTHON_1_0",
  "negative_decision_completeness": {
    "archive_identity": true,
    "no_decisive_collision": true,
    "no_decisive_nonregular": true,
    "no_generated_marker": true,
    "no_positive": true,
    "no_suspicious_test_intent": true,
    "no_unsupported_test_intent": true,
    "path_boundary": true,
    "supported_sources_decoded": true
  },
  "nondecisive_warnings": [],
  "positive_evidence": [],
  "schema": "PAPER04_N2_REFERENCE_V4_1_SOURCE_RESULT_1_0"
}
