{
  "archive": {
    "bytes": 1304884,
    "sha256": "5cbe91befd83eeb7f58cf3cb08c296d545471b03446abc81fa1ba9ceb0e39d99",
    "validity": "VALID"
  },
  "audit_id": "0233c789112cebdb",
  "category": "SOURCE_EVIDENCE_UNRESOLVED",
  "decision_blocking_unresolved_reasons": [
    "SUSPICIOUS_TEST_INTENT_WITHOUT_SUPPORTED_FRAMEWORK"
  ],
  "implementation_id": "REFERENCE_V4_1_IMPLEMENTATION_A_PYTHON_1_0",
  "negative_decision_completeness": {
    "archive_identity": true,
    "no_decisive_collision": true,
    "no_decisive_nonregular": true,
    "no_generated_marker": true,
    "no_positive": true,
    "no_suspicious_test_intent": false,
    "no_unsupported_test_intent": true,
    "path_boundary": true,
    "supported_sources_decoded": true
  },
  "nondecisive_warnings": [],
  "positive_evidence": [],
  "schema": "PAPER04_N2_REFERENCE_V4_1_SOURCE_RESULT_1_0"
}
