{
  "archive": {
    "bytes": 81011,
    "sha256": "1d2bbde8c5519df93d4894a9605d7ca1e92d6c5a81c9ae111123f155f3bf1737",
    "validity": "VALID"
  },
  "audit_id": "0301c5f731e746ce",
  "category": "NO_SUPPORTED_TEST_SOURCE_IDENTIFIED",
  "decision_blocking_unresolved_reasons": [],
  "implementation_id": "REFERENCE_V4_1_IMPLEMENTATION_A_PYTHON_1_0",
  "negative_decision_completeness": {
    "archive_identity": true,
    "no_decisive_collision": true,
    "no_decisive_nonregular": true,
    "no_generated_marker": true,
    "no_positive": true,
    "no_suspicious_test_intent": true,
    "no_unsupported_test_intent": true,
    "path_boundary": true,
    "supported_sources_decoded": true
  },
  "nondecisive_warnings": [],
  "positive_evidence": [],
  "schema": "PAPER04_N2_REFERENCE_V4_1_SOURCE_RESULT_1_0"
}
