{
  "archive": {
    "bytes": 180,
    "sha256": "8aa41f01b45d2fd3f25c50bb03587a2f702158e7951540827ebfc4ee0c9ed0d4",
    "validity": "VALID"
  },
  "audit_id": "f000000000000002",
  "category": "SOURCE_SUPPORTED_TEST_PRESENCE",
  "decision_blocking_unresolved_reasons": [],
  "implementation_id": "REFERENCE_V4_1_IMPLEMENTATION_B_RUBY_1_0",
  "negative_decision_completeness": {
    "archive_identity": true,
    "no_decisive_collision": true,
    "no_decisive_nonregular": true,
    "no_generated_marker": true,
    "no_positive": false,
    "no_suspicious_test_intent": true,
    "no_unsupported_test_intent": true,
    "path_boundary": true,
    "supported_sources_decoded": true
  },
  "nondecisive_warnings": [],
  "positive_evidence": [
    {
      "path": "src/test/java/ImportOnly.java",
      "sha256": "2e087f07587148f4dd1bad5ebea6a95af82f16b51a2f174eef2d8b0147319f7b",
      "supporting_rules": [
        "PATH_B_JUNIT_TEST_INTENT_FRAMEWORK_EVIDENCE"
      ]
    }
  ],
  "schema": "PAPER04_N2_REFERENCE_V4_1_SOURCE_RESULT_1_0"
}
